Vote Year;Council District;Category;Project Number;Title;Description;Address;Votes;Winner;Cost;BP Funding;Borough Code;Latitude;Longitude;Postcode;Community Board;Census Tract;BIN;BBL;NTA
2014;23;Community Facilities;;IT Infrastructure and Technology Upgrade for SNAP Senior Centeräó»s planned new building;;;;0;200,000;;4;;;; ;;;;
2015;26;Streets and Transportation;22; Real Time Passenger Information;Bus time countdown clocks in locations around the 26th District.;City Council District 26 ;180;1;100,000;0;4;;;; ;;;;
2016;10;Parks & Recreation;11;Repair & Fitness Area: Sunken Playground;;;453;0;485,000;0;1;;;; ;;;;
2016;10;Transit;10;Real Time Passenger Information;;;463;0;200,000;0;1;;;; ;;;;
2017;44;Youth;3;STEMLab for Brooklyn School of Inquiry;;;2,113;1;500,000;;3;;;; ;;;;
2015;3;Parks & Recreation;8; New Park for the Community;Transform the vacant lot on West 20th Street into a new public park for the community. Project would go towards demolishing the former Department of Sanitation building and environmental clean up.;136 W. 20th St. (Chelsea);1,342;1;200,000;0;1;40.741508;-73.995327;10011;4;87;1014738;1007950066;Hudson Yards-Chelsea-Flatiron-Union Square                                 
2015;3;Parks & Recreation;9; Revitalization of Chelsea Waterside Park;Chelsea has very limited green park space. The project would bring residents into this underused park by creating an interactive garden for local children, focusing on ethnobotany and native plants.;11th Ave. b/w W.22nd & W.24th (Chelsea);758;1;85,000;0;1;;;; ;;;;
2015;3;Culture and Community Facilities;2; Renovations for Jefferson Library Market;Jefferson Market Library is one of the busiest libraries in Manhattan with up to 1,000 people visiting each year. Funding would go towards renovating the lobby bathroom to make it ADA-compliant.;425 Avenue of the Americas (West Village);648;1;500,000;0;1;40.734323;-73.999065;10011;2;71;1082668;1006060001;West Village                                                               
2015;3;Schools;4; Bathroom Renovations at Lab School;Students avoid current bathroom issues by waiting until after school and utilizing local restaurants. Project would renovate 2 student bathrooms on each floor and bathrooms adjacent to the cafeteria.;333 W. 17th St. (Chelsea);594;1;560,000;0;1;40.742129;-74.002198;10011;4;83;1079152;1007410010;Hudson Yards-Chelsea-Flatiron-Union Square                                 
2015;3;Streets and Transportation;17; Sidewalk Repair/Replacement;The sidewalk on West 26th Street between 9th and 10th Avenues is in desperate need of repair. It has become difficult to walk, push carriages and wheelchairs on the sidewalk.;Chelsea-Elliot Houses (Chelsea);578;1;50,000;0;1;;;; ;;;;
2015;3;Schools;6; PS3 Library Renovations;The library has not been renovated in over a decade. With the technological advances of the last decade, modernizing the library is important in meeting the educational needs of today's students.;490 Hudson St. (West Village);533;1;35,000;0;1;40.732593;-74.006466;10014;2;73;1009872;1005850041;West Village                                                               
2015;3;Streets and Transportation;15; Pedestrian Safety: Raised Crosswalks;Help prevent further crashes, death and injuries for pedestrians by installing a speed table at a notoriously dangerous crosswalk at West 45th Street and 9th Avenue.;West 45th St. and 9th Ave. (Hell's Kitchen);532;1;250,000;0;1;;;; ;;;;
2015;3;Culture and Community Facilities;1; Cooling System for Muhlenberg Library;Funding will replace the building's HVAC cooling unit to ensure that the branch can continue to serve as a cool space in the summer months, which includes serving as an official NYC Cooling Center.;209 W. 23rd St. (Chelsea);571;0;500,000;0;1;40.744355;-73.996229;10011;4;91;1014150;1007730038;Hudson Yards-Chelsea-Flatiron-Union Square                                 
2015;3;Schools;5; Bathroom Renovations for PS3;Renovation of existing bathroom facilities to promote a more sanitary environment for all students, faculty and school visitors.;490 Hudson St. (West Village);515;0;100,000;0;1;40.732593;-74.006466;10014;2;73;1009872;1005850041;West Village                                                               
2015;3;Parks & Recreation;11; Hell's Kitchen Community Composting Center;A year-round solar-powered, forced air composting system for residents of Hell's Kitchen. The center would have the capacity for at least two compost drop-off days a week.; (Hell's Kitchen);483;0;35,000;0;1;;;; ;;;;
2015;3;Streets and Transportation;16; Bus Time Clocks for the M11 & M12 Bus Routes;Installation of bus time clocks that will provide waiting passengers with time information and bus arrival times.; (Along the M11 and M12 Routes);412;0;200,000;0;1;;;; ;;;;
2015;3;Schools;3; Campus Renovations for Lab School;Hudson Guild, Lab High School, Lab Middle School, and Museum School will benefit from new gym bleachers, gym scoreboard, and locker room bathroom renovations.;333 W. 17th St. (Chelsea);363;0;290,000;0;1;40.742129;-74.002198;10011;4;83;1079152;1007410010;Hudson Yards-Chelsea-Flatiron-Union Square                                 
2015;3;Parks & Recreation;10; Downing Playground and Fountain Upgrades;Playground upgrades with new play equipment for children, as well as a safer, more child-friendly drinking fountain to replace the aging concrete structure that is currently falling apart.;1 Downing St. (West Village);337;0;200,000;0;1;40.729684;-74.002601;10014;2;67;1000000;1005270080;West Village                                                               
2015;3;Parks & Recreation;14; Upgrading Fulton Houses Basketball Court;This project will offer all residents access to a modern basketball court. Court requires pavement to be leveled, drainage correction, proper landscaping and court markings.;Fulton Houses (Chelsea);316;0;425,000;0;1;;;; ;;;;
2015;3;Parks & Recreation;12; New Soccer Turf Field at Fulton Houses;New soccer turf, including physical safety and ball-strike safety fence or netting for neighboring window safety, marked field, and durable permanent mini goals.;Fulton Houses (Chelsea);297;0;500,000;0;1;;;; ;;;;
2015;3;Parks & Recreation;13; Resurfacing Toddler Sprinkler at Fulton Houses;The toddler sprinkler area is used extensively by the children. The area needs to be excavated and resurfaced with the right materials so the children can continue to enjoy it and play safely.;Fulton Houses (Chelsea);281;0;345,000;0;1;;;; ;;;;
2015;38;Public Safety;11; Replace Fence in Sunset Park;4-foot high fence replacement in Sunset Park.;On 5th Ave. from 41 to 44 Sts (Sunset Park);1,981;0;500,000;0;3;;;; ;;;;
2015;22;Parks & Recreation;14; Fitness Upgrade: Whitey Ford Field;Upgrade the fitness equipment, enhancing the public health benefits of the playground.;26 Ave. and 2 St. (Astoria);234;0;300,000;0;4;;;; ;;;;
2015;3;Schools;7; Public Address System Upgrade;Public Address (PA) system repair and upgrades to support the needs of three separate schools in the building, as well as building-wide announcements.;333 W. 17th St. (Chelsea);238;0;500,000;0;1;40.742129;-74.002198;10011;4;83;1079152;1007410010;Hudson Yards-Chelsea-Flatiron-Union Square                                 
2015;5;Schools;5; Green Roof for PS/IS 217;Build a green roof for environmental education at P.S./I.S. 217.;645 Main Street (Roosevelt Island);845;1;500,000;0;1;40.763894;-73.947916;10044;8;23,802;1084848;1013730001;Lenox Hill-Roosevelt Island                                                
2015;5;Schools;4; Rooftop Recreation for PS 151;Create a necessary outdoor play space on the roof with the opportunity to add a greenhouse and Edible School Yard for P.S. 151.;421 E. 88th Street (Upper East Side);754;1;500,000;0;1;40.777911;-73.947757;10128;8;14,402;1050618;1015680008;Yorkville                                                                  
2015;5;Culture and Community Facilities;3; Study of Sight and Sound;Audio/Visual equipment with an audio induction loop for the New York Public Library Roosevelt Island branch.;504 Main Street (Roosevelt Island);741;0;35,000;0;1;40.760648;-73.951186;10044;8;23,801;1083215;1013730001;Lenox Hill-Roosevelt Island                                                
2015;5;Housing;10; Security Cameras for Holmes Towers;Add new security cameras for increased safety for residents of Holmes Towers.;E. 93rd Street and First Ave. (Upper East Side);484;0;500,000;0;1;;;; ;;;;
2015;5;Culture and Community Facilities;1; Cool Reading;Upgrade the cooling system for the New York Public Library Webster branch.;1465 York Avenue (Upper East Side);481;0;500,000;0;1;40.770485;-73.95111;10075;8;132;1045991;1014720028;Lenox Hill-Roosevelt Island                                                
2015;5;Schools;6; School Stage for Eleanor Roosevelt High School;Upgrade the stage, seating, floor, lighting, audio equipment, and an audio loop for the hard of hearing, to enable more performance uses and an orchestra at Eleanor Roosevelt H.S.;411 E. 76th Street (Upper East Side);472;0;500,000;0;1;40.770187;-73.953608;10021;8;132;1045949;1014710005;Lenox Hill-Roosevelt Island                                                
2015;5;Parks & Recreation;14; Esplanade Greenway;Create and improve the tree beds along the East River Esplanade and complete construction of unfinished sites.;East River Esplanade (District wide);471;0;200,000;0;1;;;; ;;;;
2015;5;Schools;8; STEM Education for High School;Laptop carts to provide Science Technology Engineering and Math (STEM) education for Title I High Schools serving low-income students at Vanguard and Life Sciences.;317 E.67th St & 320 E.96th St (Upper East Side & El Barrio);396;0;280,000;0;1;40.765359;-73.960059;10065;8;118;1083343;1014420001;Lenox Hill-Roosevelt Island                                                
2015;5;Streets and Transportation;16; Bus Bulbs;Bus bulbs with streetscape improvements to support pedestrian safety and off-board payment on E. 86th Street at Lexington and Third Avenues.;E86th at 3rd and Lexington Ave (Upper East Side);357;0;150,000;0;1;;;; ;;;;
2015;5;Schools;7; School's Cool for PS198/PS 77;Air conditioning renovation for building-wide cooling in hot summer months at P.S.198/P.S.77.;1700 Third Ave (Upper East Side);349;0;500,000;0;1;40.784826;-73.949611;10128;8;15,801;1048492;1015240023;Upper East Side-Carnegie Hill                                              
2015;5;Parks & Recreation;13; Irrigate the Esplanade;Irrigation for the East River Esplanade to allow for increased access to water for trees and vegetation along walkway.;East River Esplanade (District wide);336;0;300,000;0;1;;;; ;;;;
2015;5;Housing;11; Security Cameras for Lexington Houses;Add new security cameras for increased safety for residents of Lexington Houses.;E98th to E99th & Park to Third (El Barrio);302;0;500,000;0;1;;;; ;;;;
2015;5;Housing;9; Community Garden for Lexington Houses;New planters and gates so that residents can grow plants in a community garden with additional plantings throughout the grounds.;E98th to E99th & Park to Third (El Barrio);283;0;385,000;0;1;;;; ;;;;
2015;5;Parks & Recreation;12; Full Court Press;Renovate basketball courts at John Jay Park including new backboards, hoops and sports coating.;E.76th to E.78th Sts & FDR Dr. (Upper East Side);239;0;400,000;0;1;;;; ;;;;
2015;5;Culture and Community Facilities;2; Bright Minds;Replace and improve the exterior lighting on the New York Public Library East 67th Street branch.;328 E. 67th Street (Upper East Side);238;0;280,000;0;1;40.765257;-73.959868;10065;8;118;1044749;1014410038;Lenox Hill-Roosevelt Island                                                
2015;5;Parks & Recreation;15; Fun Fountain at St. Catherine's Park;Replace the fountain and spray shower with new plumbing, interactive spray heads and sports-coating for children to play on at St. Catherine's Park.;E.67th to E.68th & First Ave. (Upper East Side);215;0;200,000;0;1;;;; ;;;;
2015;6;Culture and Community Facilities;2; Mobile Food Pantry for West Side Campaign against Hunger;Purchasing a specialized van to serve as a food pantry to provide food & social services to those in need. The van will be operated & maintained by the West Side Campaign against Hunger;263 W. 86th St. (WSCAH HQ) (Throughout the District);1,163;1;250,000;0;1;40.788672;-73.977332;10024;7;175;1033195;1012347502;Upper West Side                                                            
2015;44;Parks & Recreation;1; Renovations to Friends Field;Upgrade and expand existing playground.;E.4th St. and Avenue L (Midwood);777;0;500,000;0;3;;;; ;;;;
2015;6;Parks & Recreation;9; Hudson River Greenway Bike and Pedestrian Pathway Improvements;Implementation of safety measures to separate the path on the popular Hudson River Greenway into cyclist and pedestrian routes in order to decrease congestion and promote safety.;Greenway from 72nd-84th Sts. (Riverside Park);873;1;200,000;0;1;;;; ;;;;
2015;26;Parks & Recreation;26; Woodside Reforestry;Variety of NYC Parks Department-approved trees planted in tree pits on both sides of Broadway in Woodside.;49th Street - 69th Street (Woodside);186;1;200,000;0;4;;;; ;;;;
2015;6;Streets and Transportation;13; Countdown Meter Clocks at Crosstown Bus Stops on 96th, 86th, 79th & 65th St.;Installing Real Time Passenger Information Clocks at east-bound crosstown at the 96th, 86th, 79th and 66th Street bus stop stations to improve public transportation experience.;96th, 86th, 79th & 65th Sts. (District wide);840;1;240,000;0;1;;;; ;;;;
2015;6;Schools;3; Turf Field at Martin Luther King High School;Initial design for the construction of an 11,000 sq ft illuminated, artificial turf athletic field. It will serve as practice space for multiple school sports teams & for community sport programs.;Martin Luther King, Jr. Campus (122 Amsterdam Ave. on 65th St.);781;1;300,000;0;1;;;; ;;;;
2015;6;Culture and Community Facilities;1; Air Conditioning Renovations at the NYPL for the Performing Arts;Renovating a 40-year-old air conditioning system at the New York Public Library of Performing Arts will allow visitors to comfortably access the library during the warmer months.;65th St. and Amsterdam Ave. (Lincoln Square);765;0;350,000;0;1;;;; ;;;;
2015;6;Parks & Recreation;8; New Crew cab pick-up truck for garbage collection in Riverside Park;Purchasing a new crew cab pick-up truck for increased garbage collection to be used throughout Riverside Park by the Parks Department;Riverside Park ;677;0;40,000;0;1;;;; ;;;;
2015;6;Schools;4; Inclusive Playground at the Joan of Arc Public School Complex;Initial scope and planning for an all-inclusive and accessible playground in the Joan of Arc School complex to enable children with disabilities to freely play and interact with other students.;W. 93rd St. and Columbus Ave. ;629;0;300,000;0;1;;;; ;;;;
2015;6;Streets and Transportation;11; 70th Street Broadway/Amsterdam Avenue Permanent Bowtie Safety improvements;Permanent safety improvements to pedestrian crossing area by building out painted areas. The project will extend to West End Avenue and 70th Street.;*Project submitted by the DOT (not through community process);614;0;300,000;0;1;;;; ;;;;
2015;6;Schools;5; Technology Upgrades at Public High schools located at Brandeis Campus;Enhancing the technology department of the schools located in the Louis D. Brandeis High School complex through new computers and smart boards.;145 West 84 St. (Brandeis School Complex);486;0;200,000;0;1;40.785803;-73.974614;10024;7;169;1032128;1012150001;Upper West Side                                                            
2015;6;Schools;6; A Garden at P.S. 191;Creating a garden and green space at P.S. 191 for students.;210 W. 61st St. ;471;0;200,000;0;1;40.771925;-73.987328;10023;7;147;1030320;1011520029;Lincoln Square                                                             
2015;6;Schools;7; Air Conditioning wiring for P.S. 191 Lunchroom;Wiring to create a split screen to provide air conditioning for the lunchroom in P.S. 191. This will provide a comfortable environment for students during the warmer months of the year.;210 W 61st St. ;444;0;250,000;0;1;40.771925;-73.987328;10023;7;147;1030320;1011520029;Lincoln Square                                                             
2015;6;Housing;14; Barrels Playground Renovation at Amsterdam Houses (NYCHA);Renovating playground and outdated equipment at the Amsterdam Houses' Barrels Playground to benefit resident families and children.;W. 61st St. & West End Ave. (Amsterdam Houses);404;0;500,000;0;1;;;; ;;;;
2015;6;Housing;15; Back plaza and playground upgrades at 589 Amsterdam Ave (NYC Housing Authority);Upgrade and improve the upper & lower recreation area behind the 589 Amsterdam Ave. building to provide residents with chairs, tables, benches, & trees to use for congregating and leisurely activities;88th St. & Amsterdam Ave. ;398;0;500,000;0;1;;;; ;;;;
2015;6;Parks & Recreation;10; Hudson Beach Recreation Area Upgrade;Installation of adult workout equipment and upgrade of the Swing-A-Ring area in Riverside Park to promote safety and better use of the area.;103-102nd St. & Riverside Park (Riverside Park, Hudson Beach);361;0;130,000;0;1;;;; ;;;;
2015;6;Streets and Transportation;12; Curb Cut repair on 680 Amsterdam Avenue;Repairing existing curb-cut on the northwest corner of 93rd Street and Amsterdam Avenue. Determined by Community Board 7 survey and by assessment from the Department of Transportation.;680 Amsterdam Ave. on 93rd St. ;264;0;115,000;0;1;40.792219;-73.971719;10025;7;179;1033648;1012410025;Upper West Side                                                            
2015;7;Parks & Recreation;1; Basketball Court Repair at Playground 125;Make crucial surface repairs to basketball courts and playground area. This playground is used by neighborhood children and students from P.S. 125, Columbia Secondary School, and Kipp Starr.;Morningside Ave. & W. 123 St. (Morningside Heights);823;1;500,000;0;1;;;; ;;;;
2015;7;Streets and Transportation;3; Planting Sidewalk Trees;Planting new street trees and installing tree guards. 50 new trees and guards around Grant Houses and 50 new trees and guards between Riverside Drive and Broadway from 130th Street to 139th Street.;Grant Houses and 130th Streets (Harlem and Morningside Heights);723;1;300,000;0;1;;;; ;;;;
2015;7;Parks & Recreation;10; Grant Houses Playground Repair;Major playground renovations and repairs to beautify and allow for better use of a play area utilized by the 4,500 residents who rely on the space for play and exercise.;125th b/w Broadway & Amsterdam (Morningside Heights);695;1;450,000;0;1;;;; ;;;;
2015;7;Parks & Recreation;2; Public Greenhouse in Hamilton Heights;This project will fund a greenhouse in Frank White Memorial Garden that will incorporate innovative garden projects like composting systems, hydroponics, and sustainable activities.;506 W. 143rd St. (Hamilton Heights);679;1;50,000;0;1;40.824306;-73.949441;10031;9;229;1000000;1020740045;Hamilton Heights                                                           
2015;7;Youth;11; Youth Technology Lab;This project will create a permanent space for neighborhood youth to engage in design thinking and project-based learning. The purpose of this space is to foster and encourage STEM learning in youth.;503 W. 145th St. (Hamilton Heights);693;0;900,000;0;1;40.825431;-73.948049;10031;9;229;1061938;1020770026;Hamilton Heights                                                           
2015;8;Housing;23; Wilson Houses: Grounds Improvements;Renovate playground and install standard playground equipment.;305 E.105th St. (El Barrio/East Harlem);718;0;375,000;0;1;40.78978;-73.942497;10029;11;170;1052754;1016770005;East Harlem South                                                          
2015;7;Culture and Community Facilities;6; Out of School Time Center;Build out basement space in the Hamilton Grange Library to create a 600 square foot permanent ADA accessible classroom. Work will include new H/VAC, lighting, electrical, IT and security systems.;503 W. 145th St. (Hamilton Heights);689;0;900,000;0;1;40.825431;-73.948049;10031;9;229;1061938;1020770026;Hamilton Heights                                                           
2015;7;Parks & Recreation;4; Repairs to Riverside Park Northern Area;Repairs to a neglected section of Riverside Park at Riverside Dr. from 138th-148th Streets, including fencing and landscape improvements, playground renovations, ball field repairs and erosion repair.;Riverside Dr. & W. 138-148 Sts (Hamilton Heights);606;0;250,000;0;1;;;; ;;;;
2015;7;Culture and Community Facilities;5; Public Library Elevator Repairs;Elevator repairs for the Hamilton Grange Library, a four floor building serving people of all ages from the community. The elevator is in major need of repair and of full ADA access.;503 W. 145th St. (Hamilton Heights);598;0;300,000;0;1;40.825431;-73.948049;10031;9;229;1061938;1020770026;Hamilton Heights                                                           
2015;7;Schools;13;P.S. 4 School Garden;Reconstruction and replacement of existing playground structures, the installation of a school garden and planting of new trees within the playground. Project will make the area more safe and fun.;500 W. 160th St. (Washington Heights);588;0;300,000;0;1;40.834899;-73.941085;10032;12;245;1062792;1021180022;Washington Heights South                                                   
2015;7;Parks & Recreation;9; Manhattanville Houses Playground Repairs;Complete renovation of recreational area including basketball hoops and courts, new play surfaces, and safety and aesthetic improvements to serve a heavily used and much needed open space.;129th St.-133rd St.at Broadway (Manhattanville);583;0;450,000;0;1;;;; ;;;;
2015;7;Youth;12; Computer Lab Upgrade at PS 163;Improve technology instruction by equipping the lab with 36 new Mac desktops to replace existing, outdated computers, and two mobile carts with 48 Mac laptops.;163 W. 97th St. (Upper West Side);534;0;90,000;0;1;40.794264;-73.968706;10025;7;185;1055908;1018520099;Upper West Side                                                            
2015;7;Streets and Transportation;15; Street Lighting Upgrade at Amsterdam Avenue;Installation/replacement of existing lampposts with Bishop Crook lampposts (antique replicas) at Amsterdam Avenue from 125th Street-140th Street and 146th Street-155th Street.;Amsterdam Ave. 125-140&146-155 (Hamilton Heights);508;0;632,000;0;1;;;; ;;;;
2015;7;Streets and Transportation;16; Riverside Park Sidewalk Repairs near 137 St;Sidewalk repairs and improvements along a much needed stretch of parts of Riverside Park between 137th Street and 145th Street.;Riverside Park 137th-145th Sts (Manhattanville);491;0;400,000;0;1;;;; ;;;;
2015;7;Culture and Community Facilities;8; Electrical Upgrades at Morningside Heights Branch;An electrical upgrade allowing for more electrical outlets and capacity to accommodate today's technology needs. More patrons can plug in laptops, phones and other devices.;2900 Broadway (Morningside Heights);315;0;500,000;0;1;40.806172;-73.965229;10025;9;199;1057018;1018857501;Morningside Heights                                                        
2015;7;Culture and Community Facilities;7; Electrical Upgrades at Bloomingdale Library;An electrical upgrade allowing for more electrical outlets and capacity to accommodate today's technology needs. More patrons can plug in laptops, phones and other devices.;150 W. 100th St. (Upper West Side);294;0;500,000;0;1;40.796363;-73.967831;10025;7;185;1055906;1018520049;Upper West Side                                                            
2015;7;Streets and Transportation;14; Street Lighting Upgrade at Hamilton Place;Installation/replacement of existing lampposts with Bishop Crook lampposts (antique replicas) in Hamilton Place from 138th-144th Streets. The project will provide adequate lighting and improve safety.;Hamilton Pl. from 138th-144th (Hamilton Heights);244;0;196,400;0;1;;;; ;;;;
2015;8;Housing;22; Wilson Houses: Basketball Court Renovations;Renovation to basketball court.;405 E.105 St. (El Barrio/East Harlem);1,095;1;375,000;0;1;40.788875;-73.94036;10029;11;162;1079367;1016990001;East Harlem South                                                          
2015;8;Schools;14; School Technology Upgrades;Technology upgrades for the Academy of Applied Math and Technology, South Bronx Preparatory School, P.S. 161 and International Community High School.; (Bronx - Mott Haven & Longwood);998;1;500,000;0;1;;;; ;;;;
2015;8;Culture and Community Facilities;19; 125th Street Library: ADA Ramp;Replace current detachable ramp with a permanent, concrete and ADA-compliant ramp.;224 E. 125th St. (El Barrio/East Harlem);963;1;500,000;0;1;40.803389;-73.935102;10035;11;242;1054674;1017890037;East Harlem North                                                          
2015;8;Parks & Recreation;18; Boys & Girls Harbor: Playground Renovations;"Revitalize entire playground; install new basketball courts with standard basketball equipment, softer surfacing and small seating and eating area.";1 E. 104th St. (El Barrio/East Harlem);844;1;275,000;0;1;40.792888;-73.951826;10029;11;168;1051499;1016100001;East Harlem South                                                          
2015;8;Youth;15; Air Conditioning at Bronx Schools;Installation of 1 air conditioning system at 345 Brooke Avenue for schools X343, X224 & X334. Installation of 1 air conditioning system at PS 161x.;628 Tinton Ave, 345 Brook Ave. (Bronx - Mott Haven & Longwood);786;1;500,000;0;1;;;; ;;;;
2015;8;Housing;24; East River Houses: Door Upgrades;Install new doors throughout East River Houses.;418 East 105th St. (El Barrio/East Harlem);843;0;700,000;0;1;40.788645;-73.939855;10029;11;162;1083946;1016960001;East Harlem South                                                          
