Vote Year;Council District;Category;Project Number;Title;Description;Address;Votes;Winner;Cost;BP Funding;Borough Code;Latitude;Longitude;Postcode;Community Board;Census Tract;BIN;BBL;NTA
2016;39;Education;3;West Brooklyn Community HS Portable Laptop Lab;Three mobile carts with 25 laptops each will travel among classrooms to support instruction and foster IT skills. West Brooklyn Community HS is a transfer high school offering a second chance to high-needs students.;1053 41st Street, Borough Park;1,275;1;105,000;0;3;40.642834;-73.992948;11219;12;110;3328583;3055870038;Sunset Park East                                                           
2016;39;Parks & Recreation;6;Brand New Dog Run: Areas for Big and Small Dogs;Many Kensington and Windsor Terrace dog owners do not have access to fenced-in space where their pups can exercise and socialize. Project is shared with Council Member Eugene & Borough President Adams;Parade Grounds (at unused southwest corner);796;1;135,000;1;3;;;; ;;;;
2016;39;Parks & Recreation;4;"New ""Lake Mess Monster"" an Aquatic Weed Harvester";"Prospect Park needs a new aquatic weed harvester (aka ""Lake Mess Monster"") to remove scum from the lake. Without it, the scum will sink and proceed to rot, causing the water to become toxic.";Prospect Park Lake;1,692;1;140,000;0;3;;;; ;;;;
2016;39;Parks & Recreation;5;Year-Round, Freeze-Resistant Drinking Fountains;The water fountains in Prospect Park are not available to use during the winter months. This upgrade would make 5 fountains along the Prospect Park Drive freeze-resistant and available year-round.;Prospect Park, 5 Locations along the Drive;1,541;1;175,000;0;3;;;; ;;;;
2016;39;Transit;8;Curb Extension & Safer Crossing- Carroll Park;The installation of a curb extension at this very busy intersection would shorten the crossing distance and promote pedestrian safety for families and residents using Carroll Park.;Intersection of Carroll and Court Streets;1,115;1;150,000;0;3;;;; ;;;;
2016;39;Transit;9;Pedestrian Safety: Curb Ext. on Columbia St.;The installation of a curb extension at this very busy intersection would shorten the street crossing distance and increase pedestrian safety in this growing neighborhood.;Intersection of Union and Columbia Streets;924;0;150,000;0;3;;;; ;;;;
2016;39;Transit;10;Replace Cross-Hatch with Concrete on PPSW;Construct sidewalk on the southwest corner at Prospect Park Southwest and 16th Street, where there is only a painted cross-hatch, to improve pedestrian access to Prospect Park and nearby bus stops.;Prospect Park Southwest and 16th Street;868;0;500,000;0;3;;;; ;;;;
2016;39;Transit;7;Bus Clocks on B67/B69: Know When Bus Arrives!;Install bus countdown clocks that display real-time information about bus location at 12 B67/B69 stops. This will help mass transit users estimate wait times and make better travel decisions.;McDonald, 7th and Flatbush Avenues;1,533;1;240,000;0;3;;;; ;;;;
2016;40;Education;1;Computer Lab Updates for Local Schools;General technology updates at P.S. 249, P.S. 245, P.S. 139, and P.S. 6;PS 249, PS 245, PS 139, PS 6;803;1;140,000;0;3;;;; ;;;;
2016;40;Education;3;Gymnasium Upgrades at Erasmus High School;Physical upgrades to the gymnasium;911 Flatbush Avenue;514;1;150,000;0;3;40.649787;-73.95855;11226;14;794;3336215;3051030010;Erasmus                                                                    
2016;40;Education;4;Smartboards for P.S. 92;Twenty-nine smartboards are needed for PS 92.;601 Parkside Avenue;396;1;175,000;0;3;40.656046;-73.953742;11226;9;802;3115866;3050490055;Prospect Lefferts Gardens-Wingate                                          
2016;40;Education;2;Technology Updates for M.S. 2 Parkside Academy;Various technological updates at M.S. 2 Parkside Academy;655 Parkside Avenue;489;1;35,000;0;3;40.656183;-73.951583;11226;9;802;3378201;3050500051;Prospect Lefferts Gardens-Wingate                                          
2016;40;Parks & Recreation;7;Community Barbecue Sites in Prospect Park;"New-style municipal grills, which are similar to those at Brooklyn Bridge Park Picnic Peninsula.
";"Lincoln Rd & E Drive; Parkside Ave & E Drive
";522;1;80,000;0;3;;;; ;;;;
2016;40;Parks & Recreation;5;Kensington Dog Run;An enclosed Dog Run at the Parade Grounds;Parade Grounds;309;1;135,000;0;3;;;; ;;;;
2016;40;Parks & Recreation;6;"Replacement of ""Lake Mess Monster""";"A vessel that would grind up duck weed and other contaminants that cause visible pollution in the Prospect Park Lake.
";Prospect Park Lake;440;1;140,000;0;3;;;; ;;;;
2016;40;Transit;11;Little Red Riding Hood Pre-K Sidewalk Extension;Sidewalk extensions at this corner paired with heavy-duty bollards;NE corner of Rogers Ave. and Lefferts Ave.;199;1;300,000;1;3;;;; ;;;;
2016;40;Transit;8;Montessori School Sidewalk Extension;Sidewalk extension on the South East corner matched by a painted curb extension with flexible post barriers;SE corner of Rogers Ave. and Rutland Rd.;187;0;300,000;0;3;;;; ;;;;
2016;40;Transit;10;P.S. 92 Sidewalk Extension;A concrete sidewalk extension, which could be matched by a painted curb extension with flexible post barriers on the North West corner.;SW corner of Rogers Ave. and Winthrop St.;232;0;300,000;0;3;;;; ;;;;
2016;40;Transit;9;Real-Time Passenger Information;Bus display signs that are visible from a distance and inform riders when their bus will arrive;"Lincoln Rd Entrance; Church Ave. B35 Stop";385;1;40,000;0;3;;;; ;;;;
2016;44;Arts, Culture & Community;12;OHEL;Ohel is a premier social services organization throughout the District. This project will supplement funding for a new, state of the art center.;District Wide;1,012;1;500,000;0;3;;;; ;;;;
2016;44;Public Safety;5;Hatzolah Mobile Command Center;A vehicle based command center will be a critical part of its response infrastructure in order to help provide top-tier care for all citizens of New York City.;District Wide;1,269;1;250,000;0;3;;;; ;;;;
2016;44;Public Safety;4;Safety & Security Enhancements at Mapelton Library;Upgrade and enhance security features at Mapelto Library;Borough Park;378;0;200,000;0;3;;;; ;;;;
2012;32;Parks and Recreation;;Water Installation at Freeway Dog Park;;;;0;170,000;;4;;;; ;;;;
2016;44;Public Safety;1;Security Cameras in Bensonhurst;Install 8 police monitored Argus cameras to deter crime in vulnerable public areas.;Bensonhurst;952;1;200,000;1;3;;;; ;;;;
2016;44;Public Safety;2;Van for the Auxiliary NYPD Police Squad;This van is a crucial addition to the 66 Precinct auxiliary squad. It will allow the team to respond quickly and efficiently to emergency calls.;Borough Park;745;0;70,000;0;3;;;; ;;;;
2016;44;Sanitation;10;Haulster Truck for Community Board 14;The haulster is used for plowing and salt spreading in the winter and addressing illegal dumping and litter conditions.;Midwood;553;0;167,000;0;3;;;; ;;;;
2016;44;Transit;6;B16 Count Down Clock;Never miss your bus again! Electronic signs will be installed along B16 route to inform riders when the next bus is arriving.;District Wide;767;0;200,000;0;3;;;; ;;;;
2016;44;Transit;7;Street Resurfacing;Repair and resurface roadways that have been identified as dangerous due to potholes, ridges and other holes.;District Wide;1,334;1;200,000;0;3;;;; ;;;;
2016;45;Education;1;Tech Upgrade at P.S. 208;Add Laptops and Smartboards for 500 Students at PS 208;4801 Avenue D;287;0;100,000;0;3;40.642031;-73.931151;11203;17;840;3105680;3047690025;East Flatbush-Farragut                                                     
2016;45;Education;2;Technology Upgrade for THS Campus;Add Laptops, Laptop carts, Smart boards, iPads and Upgrades to computer labs so that we can decrease the digital divide for 800+ High School students.;5800 Tilden Avenue, Brooklyn;318;0;250,000;0;3;40.648657;-73.922171;11203;17;936;3104598;3047420001;Rugby-Remsen Village                                                       
2016;45;Education;8;Update Cafeteria at THS;;5801 Tilden Avenue, Brooklyn;314;0;400,000;0;3;40.648673;-73.922175;11203;17;936;3104138;3047300010;Rugby-Remsen Village                                                       
2016;45;Education;4;Update THS Campus Auditorium;Upgrade Sound equipment, Projector and screen (adding one which comes out of the ceiling). There are 700+ students who are behind the curve using out of date technology in auditorium.;5800 Tilden Avenue;202;0;100,000;0;3;40.648657;-73.922171;11203;17;936;3104598;3047420001;Rugby-Remsen Village                                                       
2016;45;Education;3;Upgrade PA in Gym 3 at THS Campus;Upgrade the Public Address System in Gym 3 for the 500+ students, community members and staff who use this gym. Increasing the ability to clearly receive audible data and positively impact safety.;5800 Tilden Avenue;237;0;75,000;0;3;40.648657;-73.922171;11203;17;936;3104598;3047420001;Rugby-Remsen Village                                                       
2016;45;Education;5;Technology Upgrades for Midwood High School;The equipment in the Cafeteria is old and worn-out due to several water conditions and other issues. Kitchen space needs to be revamped to serve better, more nutritious, food.;5800 Tilden Avenue, Brooklyn;1,011;1;400,000;0;3;40.648657;-73.922171;11203;17;936;3104598;3047420001;Rugby-Remsen Village                                                       
2016;45;Education;6;Upgrade Field and Bathrooms at THS Track;"600+ Students & Sports Teams find it difficult to use track due to bumps and holes; and bathrooms are not safe. This also impacts the safety of Charter Elementary School children who use field.";5800 Tilden Avenue, Brooklyn;321;0;300,000;0;3;40.648657;-73.922171;11203;17;936;3104598;3047420001;Rugby-Remsen Village                                                       
2016;45;Education;10;Upgrade Field Lockers at THS Campus;Upgrade Football Field Lockers to help promote indoor track use and make the field safer for after school learners and sports teams who use our field.;5800 Tilden Avenue, Brooklyn;161;0;250,000;0;3;40.648657;-73.922171;11203;17;936;3104598;3047420001;Rugby-Remsen Village                                                       
2016;45;Public Safety;12;Safety Upgrade for THS Campus;Add Security Cameras around the school (especially in dark areas). This will increase the level of safety for over 800 students which will provide youth with a safe place to learn.;5800 Tilden Ave, Brooklyn;349;0;250,000;0;3;40.648657;-73.922171;11203;17;936;3104598;3047420001;Rugby-Remsen Village                                                       
2016;45;Public Safety;14;Upgrade Safety Cameras at Glenwood Houses;Increase safety for 2,600+ residents and the neighbors who work in Glenwood Houses by upgrading the existing security system.;Within and Around Glenwood Houses;269;0;500,000;0;3;;;; ;;;;
2016;45;Public Safety;13;Vision Zero/Safe Routes to Schools - P.S. 208;Add improvements such as raised center medians, widened sidewalks, neckdowns at intersections, to slow traffic and improve safety for 440 students, their families and staff.;4801 Avenue D, Brooklyn;261;0;300,000;0;3;40.642031;-73.931151;11203;17;840;3105680;3047690025;East Flatbush-Farragut                                                     
2016;45;Transit;16;Vision Zero/New Bus Pads;Bus pads are sections of concrete pavement at bus stops. It would be installed to prevent the weight/heat of the bus from softening the asphalt which damages the street & increases need to resurface.;Routes on Nostrand Avenue and Kings Highway;532;1;350,000;0;3;;;; ;;;;
2016;45;Transit;11;Vision Zero/Safe Routes to Schools - P.S. 361;Add improvements such as raised center medians, widened sidewalks, neckdowns at intersections, to slow traffic and improve safety for 350 students, their families and staff.;3109 Newkirk Ave;179;0;300,000;0;3;40.640066;-73.947253;11226;17;830;3112334;3049650001;East Flatbush-Farragut                                                     
2016;47;Education;6;Technology in Elementary Schools;Technology upgrades in P.S. 212, P.S. 216, P.S. 97 and P.S. 188.;P.S. 212, P.S. 216, P.S. 97 and P.S. 188;711;1;200,000;0;3;;;; ;;;;
2016;47;Education;8;Technology in High Schools;Technology upgrades in I.S. 281, I.S. 228, and I.S. 239.;I.S. 281, I.S. 228, and I.S. 239;459;1;150,000;0;3;;;; ;;;;
2016;47;Education;7;Technology in Middle Schools;Technology upgrades in Rachel Carson High School, Brooklyn Studio Secondary School, and Kingsborough Early College School.;521 West Ave, 8310 21st Ave, 2630 Benson Ave;422;1;150,000;0;3;40.582533;-73.973132;11224;13;354;3196292;3072500025;West Brighton                                                              
2016;47;Housing;2;Marlboro Houses - Security Improvements;Funds will be used to install additional security cameras at Marlboro Houses.;Marlboro Houses;409;0;150,000;0;3;;;; ;;;;
2016;47;Parks & Recreation;3;McDonald Playground - Reconstruction;Funds will be used to renovate the children's play area of McDonald Playground;McDonald Playground;779;1;500,000;1;3;;;; ;;;;
2016;47;Parks & Recreation;4;Playground Renovation - Scarangella Playground;The project will include renovations to the existing playground, spray shower, courts, paths, landscaping and sidewalks.;Scarangella Playground;319;0;300,000;0;3;;;; ;;;;
2016;47;Parks & Recreation;5;Surf Playground;"The funds will be used to reconstruct two full basketball courts. 
";Surf Playground;250;0;300,000;0;3;;;; ;;;;
2016;47;Transit;1;Bus Countdown Clocks;Real Time Passenger Information at high traffic bus stops in District 47.;District Wide;576;1;100,000;0;3;;;; ;;;;
2012;8;Housing;3;Installation of Security Cameras in Public Housing Complexes - Wagner Houses - Site 8 of 8;Installation of tamper-proof security cameras with high picture quality in public housing complexes.;2396 First Avenue, New York, NY  10035;;1;75,000;;1;40.800122;-73.932386;10035;11;192;1081296;1018080001;East Harlem North                                                          
2012;8;Housing;4;Installation of Security Cameras in Public Housing Complexes - Johnson Houses - Site 2 of 8;Installation of tamper-proof security cameras with high picture quality in public housing complexes.;165 East 112th St, New York, NY 10029;;1;60,000;;1;40.795788;-73.942766;10029;11;182;1082337;1016400021;East Harlem North                                                          
2012;8;Housing;5;Installation of Security Cameras in Public Housing Complexes - Taft Houses - Site 6 of 8;Installation of tamper-proof security cameras with high picture quality in public housing complexes.;1740 Madison Avenue, New York, NY 10029;;1;60,000;;1;40.799064;-73.945534;10029;11;184;1080509;1016180001;East Harlem North                                                          
2012;8;Housing;6;Installation of Security Cameras in Public Housing Complexes - Washington Houses - Site 5 of 8;Installation of tamper-proof security cameras with high picture quality in public housing complexes.;"1773 Third Avenue
New York, NY  10029";;1;60,000;;1;;;; ;;;;
2012;8;Housing;7;Installation of Security Cameras in Public Housing Complexes - Betances Houses - Site 3 of 8;Installation of tamper-proof security cameras with high picture quality in public housing complexes.;537 East 146th Street, Bronx, NY;;1;75,000;;1;;;; ;;;;
2012;8;Housing;8;Installation of Security Cameras in Public Housing Complexes - Jefferson Houses - Site 1 of 8;Installation of tamper-proof security cameras with high picture quality in public housing complexes.;228 East 115th St, New York, NY 10029;;1;75,000;;1;40.796739;-73.939327;10029;11;180;1080707;1016620001;East Harlem North                                                          
2012;8;Housing;9;Installation of Security Cameras in Public Housing Complexes - Millbrook Houses - Site 4 of 8;Installation of tamper-proof security cameras with high picture quality in public housing complexes.;"160 St. Ann's Avenue,
Bronx, NY  10454";;1;60,000;;1;;;; ;;;;
2012;8;Housing;12;Installation of Security Cameras in Public Housing Complexes - Clinton Houses - Site 7 of 8;Installation of tamper-proof security cameras with high picture quality in public housing complexes.;1744 Lexington Avenue, New York, NY  10029;;1;60,000;;1;40.793887;-73.945094;10029;11;172;1078925;1016360001;East Harlem South                                                          
2012;8;Housing;10;Playground Improvements - Douglass Houses - Site 2 of 2;Installation of enhanced playground equipment (climbing apparatus, castles, bridges, etc.) at Millbrook and Douglass Houses;830 Columbus Ave, New York, NY;;1;250,000;;1;40.795882;-73.965332;10025;7;189;1079350;1018550001;Upper West Side                                                            
2012;8;Housing;11;Playground Improvements - Millbrook Houses - Site 1 of 2;Installation of enhanced playground equipment (climbing apparatus, castles, bridges, etc.) at Millbrook and Douglass Houses;201 St Ann's Ave, Bronx, NY 10454;;1;250,000;;1;;;; ;;;;
2012;8;Housing;;Off Grid Solar-Powered Greenhouse;Development of a greenhouse that will provide a space to grow sustainable, healthy foods for the community and introduce residents to sustainable technology careers.;Millbrook Houses;;0;150,000;;1;;;; ;;;;
2012;8;Housing;;Designated BBQ Area;Installation of two designated BBQ areas.;Two locations at Millbrook Houses between 600 and 620 E. 137th St;;0;100,000;;1;;;; ;;;;
2012;32;Parks and Recreation;;Year Round Heated Bathroom and Changing Station at Beach 86th Street on Boardwalk;;;;0;160,000;;4;;;; ;;;;
2012;8;Senior and Social Services;;Security Upgrades at UPACA 5;Installation of security cameras and use of ID cards for UPACA 5.;1980 Lexington Ave (UPACA 5);;0;150,000;;1;40.801789;-73.939319;10035;11;196;1054377;1017690005;East Harlem North                                                          
2012;8;Senior and Social Services;;Roof Repairs at UPACA 6;Roof repairs at UPACA 6;1940 Lexington Ave (UPACA 6);;0;500,000;;1;40.80073;-73.940093;10035;11;196;1054368;1017680012;East Harlem North                                                          
2012;8;Senior and Social Services;1;Transportation for Seniors & Meals-on-Wheels Delivery Van;Purchase of vehicles that are friendly to the elderly population and purchase of a Meals-on-Wheels delivery van.;237 East 104th Street, New York, NY;;1;100,000;;1;40.789687;-73.944267;10029;11;170;1080671;1016540011;East Harlem South                                                          
2012;8;Senior and Social Services;;Gaylord White Outdoor Seating Area Renovation & Improvements;Renovation of the Gaylord White outdoor seating space by repaving the walking surface and installing new benches.;2029 2nd Ave (Gaylord White);;0;100,000;;1;40.789473;-73.943288;10029;11;170;1080669;1016540011;East Harlem South                                                          
2012;8;Youth;;Lights at Jefferson Park;Installation of lighting at Jefferson Park to enable greater usage of the park during evening hours.;2180 1st Ave;;0;300,000;;1;40.793562;-73.937181;10029;11;178;1085632;1017050001;East Harlem North                                                          
2012;8;Youth;;Skate Park;Enhancement to the skate park proposed for Jefferson Park.;Far northeast corner of Jefferson Park (2180 1st Ave);;0;150,000;;1;;;; ;;;;
2012;8;Youth;;Children's Aid Society/ Frederick Douglass Center;Theater upgrade of Children's Aid Society stage.;885 Columbus Ave at 104th St;;0;150,000;;1;40.797762;-73.963944;10025;7;189;1081301;1018360001;Upper West Side                                                            
2012;8;Youth;14;A Home for Harlem RBI and Dream Charter School;Partial costs of construction of the Headquarters of Harlem RBI and DREAM Charter School.;232 East 103rd St,æ New York, NY 10029;;0;250,000;;1;40.788952;-73.944538;10029;11;164;1052384;1016520016;East Harlem South                                                          
2012;8;Transportation and Public Safety;;Viaduct Lighting;Replacement and improvement of lighting fixtures in pedestrian tunnels along the Park Avenue viaduct.;Pedestrian tunnels along Park Ave viaduct from 102nd St to 110th St;;0;110,000;;1;;;; ;;;;
2012;8;Parks and Recreation;;Pothole Repairs on 1st and 2nd Ave;Repaving and repair of this roadway.;The 2nd Ave service lane from E. 125th St to E. 120th St and across to 1st Ave;;0;90,000;;1;;;; ;;;;
2012;8;Parks and Recreation;;Poor Richardäó»s Playground;Regrading of the sports fields in Poor Richard's Playground.;109th St between 2nd and 3rd Ave,;;0;300,000;;1;;;; ;;;;
2012;8;Parks and Recreation;;Jefferson Park Dog Run;"Creation of a new separate small dog run and an upgrade to the existing dog run; and the renovation of a dog drinking fountain with a modern dog-friendly faucet and a bowl at the bottom.";Far end of Jefferson Park near 111th St and the FDR Dr;;0;110,000;;1;;;; ;;;;
2012;8;Parks and Recreation;;Court-ship At Its Best: Booker T. Washington Basketball Court;Renovation of the Booker T. Washington basketball courts with new full-depth asphalt pavement, sports coating, and 4 new benches.;108th St between Amsterdam Ave & Columbus Ave;;0;100,000;;1;;;; ;;;;
2012;8;Parks and Recreation;;Court-ship At Its Best: Douglass Houses Stadium Court;Renovation of the Stadium Court with new basketball hoops and resurfaced court.;102nd St between Amsterdam Ave and Columbus Ave;;0;300,000;;1;;;; ;;;;
2012;8;Education;13;New Technology for NY Public Library Aguilar Branch;Technology upgrades for the Aguilar Branch, including the purchase of laptops with carts and a smartboard;174 East 110th Street, New York, NY 10029;;1;60,000;;1;40.794317;-73.94327;10029;11;172;1052167;1016370141;East Harlem South                                                          
2012;8;Education;;Central Park East High School;Purchase of 10 smartboards, 25 desktop computers, and carts for 30 laptops.;1573 Madison Ave at 106th St;;0;85,000;;1;40.793763;-73.949381;10029;11;17,401;1051515;1016120050;East Harlem South                                                          
2012;8;Education;;Technology Improvements at Renaissance Charter HS for Innovation;Purchase of 150 new laptops, 5 laptop carts, 6 new projectors, and 6 new printers.;410 E. 100th St, 2nd Floor;;0;250,000;;1;40.785671;-73.942548;10029;11;162;1052998;1016930001;East Harlem South                                                          
2012;8;Education;;Auditorium Upgrade at Manhattan Center for Science and Mathematics HS;Replacement of 100 seats in the schooläó»s auditorium, 20 seats in the music rooms, and stairwell banisters.;260 Pleasant Ave between E. 115th and E. 116th St;;0;150,000;;1;40.793856;-73.934028;10029;11;178;1053152;1017130001;East Harlem North                                                          
2012;8;Education;;Technology for Manhattan Center for Science and Mathematics HS;Purchase of 105 laptop computers, 3 carts to store the laptops, and 65 smartboards.;260 Pleasant Ave between E. 115th and E. 116th St;;0;400,000;;1;40.793856;-73.934028;10029;11;178;1053152;1017130001;East Harlem North                                                          
2012;39;Culture and Community Facilities;;Carroll Gardens Library Community Space;Community meeting room renovation with upgrades acoustics, energy efficient lighting, new PA system, and stage;;;0;250,000;;3;;;; ;;;;
2012;8;Education;;Technology for Mott Hall II, M862;Acquisition of 3 laptop carts, 90 laptops, 3 new printers, and a new smartboard.;234 W. 109th St between Broadway and Amsterdam;;0;100,000;;1;40.802917;-73.965613;10025;7;195;1056676;1018800013;Morningside Heights                                                        
2012;8;Education;;Air-Conditioned Gymnasium for P.S. 163;Installation of air conditioning in the schooläó»s gymnasium.;163 W. 97th St;;0;150,000;;1;40.794264;-73.968706;10025;7;185;1055908;1018520099;Upper West Side                                                            
2012;8;Education;;Science Lab for P.S. 171;Installation of a science lab for the 6th and 7th Grades.;19 E. 103rd St;;0;350,000;;1;40.792122;-73.951961;10029;11;168;1051497;1016090007;East Harlem South                                                          
2012;8;Education;;Technology for Young Women's Leadership;Purchase of 30 computers, 100 laptops with carts, 4 printers, and 10 smartboards.;105 E. 106th St;;0;250,000;;1;40.792741;-73.947428;10029;11;172;1052015;1016340003;East Harlem South                                                          
2012;8;Public Health and Environment;;10-Foot Pollution Barrier Wall at P.S. 206 Playground;Installation of a 10-foot wall to help prevent children playing on the playground from directly breathing air pollutants;Pleasant Ave/FDR Dr between 119th and 120th St;;0;100,000;;1;;;; ;;;;
2012;8;Public Health and Environment;2;Ultrasound System for Metropolitan Hospital Center;Purchase of an Accuvix XG Ultrasound System to obtain better quality fetal images in 3D and 4D.;1901 1st Ave, New York, NY 10029;;1;105,000;;1;40.784557;-73.94378;10029;11;15,602;1083929;1016690001;East Harlem South                                                          
2012;32;Art, Community, and Culture;15;Gazebo/Bandstand/Outdoor Performance Space on Shorefront Parkway;Gazebo/Bandstand/Outdoor Performance Space on Shorefront Parkway;8200 Shore Front Parkway Rockaway Beach, NY 11693;;1;150,000;;4;40.586253;-73.807124;11693;14;94,203;4457810;4161300001;Hammels-Arverne-Edgemere                                                   
2012;32;Art, Community, and Culture;16;Knights of Columbus, Rockaway Council--Handicapped Bathroom Upgrade;;333 Beach 90th St, Rockaway Beach, NY 11693;;1;45,000;;4;40.588363;-73.814823;11693;14;94,202;4303518;4161240084;Hammels-Arverne-Edgemere                                                   
